[
  {
    "id": "acml-2026",
    "name": "ACML",
    "fullName": "Asian Conference on Machine Learning",
    "year": 2026,
    "field": [
      "machine-learning"
    ],
    "subcategory": "ml",
    "location": "Melbourne, Australia",
    "websiteUrl": "https://www.acml-conf.org/2026/",
    "sourceUrl": "https://www.acml-conf.org/2026/calls/papers/",
    "sourceCheckedAt": "2026-05-27",
    "timezone": "AoE",
    "deadlines": [
      {
        "id": "full-paper",
        "label": "Conference Track Submission Deadline",
        "date": "2026-06-26",
        "time": "23:59",
        "timezone": "AoE",
        "type": "submission",
        "isPrimary": true
      },
      {
        "id": "reviews-released",
        "label": "Reviews Released to Authors",
        "date": "2026-08-10",
        "time": "23:59",
        "timezone": "AoE",
        "type": "notification",
        "isPrimary": false
      },
      {
        "id": "notification",
        "label": "Acceptance Notification",
        "date": "2026-09-15",
        "time": "23:59",
        "timezone": "AoE",
        "type": "notification",
        "isPrimary": false
      },
      {
        "id": "camera-ready",
        "label": "Camera-ready Submission Deadline",
        "date": "2026-09-29",
        "time": "23:59",
        "timezone": "AoE",
        "type": "camera-ready",
        "isPrimary": false
      },
      {
        "id": "conference-start",
        "label": "Conference Start",
        "date": "2026-12-01",
        "time": null,
        "timezone": "Australia/Melbourne",
        "type": "conference-start",
        "isPrimary": false
      },
      {
        "id": "conference-end",
        "label": "Conference End",
        "date": "2026-12-04",
        "time": null,
        "timezone": "Australia/Melbourne",
        "type": "conference-end",
        "isPrimary": false
      }
    ]
  },
  {
    "id": "aistats-2026",
    "name": "AISTATS",
    "fullName": "International Conference on Artificial Intelligence and Statistics",
    "year": 2026,
    "field": [
      "machine-learning",
      "statistics",
      "artificial-intelligence"
    ],
    "subcategory": "ml",
    "location": "Tangier, Morocco",
    "websiteUrl": "https://aistats.org/aistats2026/",
    "sourceUrl": "https://virtual.aistats.org/Conferences/2026/Dates",
    "sourceCheckedAt": "2026-05-27",
    "timezone": "AoE",
    "deadlines": [
      {
        "id": "abstract",
        "label": "Abstract Submission Deadline",
        "date": "2025-09-25",
        "time": "23:59",
        "timezone": "AoE",
        "type": "abstract",
        "isPrimary": false
      },
      {
        "id": "full-paper",
        "label": "Full Paper Submission Deadline",
        "date": "2025-10-02",
        "time": "23:59",
        "timezone": "AoE",
        "type": "submission",
        "isPrimary": true
      },
      {
        "id": "supplementary",
        "label": "Supplemental Material Submission Deadline",
        "date": "2025-10-09",
        "time": "23:59",
        "timezone": "AoE",
        "type": "supplementary",
        "isPrimary": false
      },
      {
        "id": "notification",
        "label": "Paper Decision Notifications",
        "date": "2026-01-22",
        "time": "23:59",
        "timezone": "AoE",
        "type": "notification",
        "isPrimary": false
      },
      {
        "id": "camera-ready",
        "label": "Camera-ready Version Deadline",
        "date": "2026-03-31",
        "time": "23:59",
        "timezone": "AoE",
        "type": "camera-ready",
        "isPrimary": false
      },
      {
        "id": "conference-start",
        "label": "Conference Start",
        "date": "2026-05-02",
        "time": null,
        "timezone": "Africa/Casablanca",
        "type": "conference-start",
        "isPrimary": false
      },
      {
        "id": "conference-end",
        "label": "Conference End",
        "date": "2026-05-05",
        "time": null,
        "timezone": "Africa/Casablanca",
        "type": "conference-end",
        "isPrimary": false
      }
    ]
  },
  {
    "id": "alt-2026",
    "name": "ALT",
    "fullName": "International Conference on Algorithmic Learning Theory",
    "year": 2026,
    "field": [
      "machine-learning",
      "learning-theory"
    ],
    "subcategory": "ml",
    "location": "Toronto, Canada",
    "websiteUrl": "https://algorithmiclearningtheory.org/alt2026/",
    "sourceUrl": "https://algorithmiclearningtheory.org/alt2026/call-for-papers/",
    "sourceCheckedAt": "2026-05-27",
    "timezone": "AoE",
    "deadlines": [
      {
        "id": "full-paper",
        "label": "Paper Submission Deadline",
        "date": "2025-10-02",
        "time": "23:59",
        "timezone": "AoE",
        "type": "submission",
        "isPrimary": true
      },
      {
        "id": "notification",
        "label": "Author Notification",
        "date": "2025-12-18",
        "time": null,
        "timezone": "AoE",
        "type": "notification",
        "isPrimary": false
      },
      {
        "id": "conference-start",
        "label": "Conference Start",
        "date": "2026-02-23",
        "time": null,
        "timezone": "America/Toronto",
        "type": "conference-start",
        "isPrimary": false
      },
      {
        "id": "conference-end",
        "label": "Conference End",
        "date": "2026-02-26",
        "time": null,
        "timezone": "America/Toronto",
        "type": "conference-end",
        "isPrimary": false
      }
    ]
  },
  {
    "id": "colt-2026",
    "name": "COLT",
    "fullName": "Conference on Learning Theory",
    "year": 2026,
    "field": [
      "machine-learning",
      "learning-theory"
    ],
    "subcategory": "ml",
    "location": "San Diego, CA, USA",
    "websiteUrl": "https://learningtheory.org/colt2026/",
    "sourceUrl": "https://learningtheory.org/colt2026/cfp.html",
    "sourceCheckedAt": "2026-05-27",
    "timezone": "AoE",
    "deadlines": [
      {
        "id": "full-paper",
        "label": "Submission Deadline",
        "date": "2026-02-04",
        "time": "23:59",
        "timezone": "AoE",
        "type": "submission",
        "isPrimary": true
      },
      {
        "id": "notification",
        "label": "Author Notification",
        "date": "2026-05-04",
        "time": null,
        "timezone": "AoE",
        "type": "notification",
        "isPrimary": false
      },
      {
        "id": "conference-start",
        "label": "Conference Start",
        "date": "2026-06-29",
        "time": null,
        "timezone": "America/Los_Angeles",
        "type": "conference-start",
        "isPrimary": false
      },
      {
        "id": "conference-end",
        "label": "Conference End",
        "date": "2026-07-03",
        "time": null,
        "timezone": "America/Los_Angeles",
        "type": "conference-end",
        "isPrimary": false
      }
    ]
  },
  {
    "id": "ecml-pkdd-2026",
    "name": "ECML PKDD",
    "fullName": "European Conference on Machine Learning and Principles and Practice of Knowledge Discovery in Databases",
    "year": 2026,
    "field": [
      "machine-learning",
      "data-mining",
      "knowledge-discovery"
    ],
    "subcategory": "ml",
    "location": "Naples, Italy",
    "websiteUrl": "https://ecmlpkdd.org/2026/",
    "sourceUrl": "https://ecmlpkdd.org/2026/submissions-research-track/",
    "sourceCheckedAt": "2026-05-27",
    "timezone": "AoE",
    "deadlines": [
      {
        "id": "abstract",
        "label": "Abstract Submission Deadline",
        "date": "2026-03-05",
        "time": "23:59",
        "timezone": "AoE",
        "type": "abstract",
        "isPrimary": false
      },
      {
        "id": "full-paper",
        "label": "Paper Submission Deadline",
        "date": "2026-03-12",
        "time": "23:59",
        "timezone": "AoE",
        "type": "submission",
        "isPrimary": true
      },
      {
        "id": "notification",
        "label": "Author Notification",
        "date": "2026-05-27",
        "time": "23:59",
        "timezone": "AoE",
        "type": "notification",
        "isPrimary": false
      },
      {
        "id": "camera-ready",
        "label": "Camera Ready Submission",
        "date": "2026-06-18",
        "time": "23:59",
        "timezone": "AoE",
        "type": "camera-ready",
        "isPrimary": false
      },
      {
        "id": "conference-start",
        "label": "Conference Start",
        "date": "2026-09-07",
        "time": null,
        "timezone": "Europe/Rome",
        "type": "conference-start",
        "isPrimary": false
      },
      {
        "id": "conference-end",
        "label": "Conference End",
        "date": "2026-09-11",
        "time": null,
        "timezone": "Europe/Rome",
        "type": "conference-end",
        "isPrimary": false
      }
    ]
  },
  {
    "id": "iclr-2026",
    "name": "ICLR",
    "fullName": "International Conference on Learning Representations",
    "year": 2026,
    "field": [
      "machine-learning",
      "artificial-intelligence"
    ],
    "location": "TBA",
    "websiteUrl": "https://iclr.cc/Conferences/2026",
    "sourceUrl": "https://iclr.cc/Conferences/2026/Dates",
    "sourceCheckedAt": "2026-05-27",
    "timezone": "AoE",
    "deadlines": [
      {
        "id": "abstract",
        "label": "Abstract Submission",
        "date": "2025-09-19",
        "time": "23:59",
        "timezone": "AoE",
        "type": "abstract",
        "isPrimary": false
      },
      {
        "id": "full-paper",
        "label": "Full Paper Submission",
        "date": "2025-09-24",
        "time": "23:59",
        "timezone": "AoE",
        "type": "submission",
        "isPrimary": true
      },
      {
        "id": "notification",
        "label": "Final Decisions",
        "date": "2026-01-25",
        "time": "23:59",
        "timezone": "AoE",
        "type": "notification",
        "isPrimary": false
      },
      {